{
  "schema_version": 1,
  "id": "ep25-fii-dii-explainer",
  "genre": "explainer",
  "audience": "curious_adult",
  "topic": "Explain FIIs and DIIs and what happened in the Indian market on 1 October",
  "questions": [
    {
      "id": "q1",
      "text": "What are FIIs and what are DIIs?"
    },
    {
      "id": "q2",
      "text": "What happened in the Indian market on 1 October and what was the reason?"
    },
    {
      "id": "q3",
      "text": "Why did DIIs jump in when FIIs sold?"
    }
  ],
  "dates": [
    {
      "raw": "1 October",
      "iso": "--10-01"
    }
  ],
  "constraints": {},
  "approvals": {
    "outline": false,
    "script": true,
    "preview": true,
    "publish": true
  }
}